{
  "format": "slate-vault",
  "vaultId": "fcd2d333-8cd6-4c81-b6f6-b3a40150cf4e",
  "revision": 2,
  "createdAt": 1793238857755,
  "profile": "standard",
  "suite": 2,
  "keyEpoch": 0,
  "kdf": {
    "alg": "argon2id",
    "memoryKiB": 64,
    "passes": 1,
    "parallelism": 1,
    "salt": "0teFTsyG1s6CloUx1ze46Q=="
  },
  "version": 3,
  "wraps": {
    "password": {
      "alg": "aes-256-gcm",
      "nonce": "KfVdd2dUGq0B0pbA",
      "ct": "dLzAVJe4KC4yySI/1+iJ+WcPS3kjDHP9vr7+0UXnCcU6mgb2+VHR3s7KqpZ8EsZH"
    },
    "recovery": {
      "alg": "aes-256-gcm",
      "nonce": "EFDkg0XA9TUXGIP+",
      "ct": "uhTaqDXWoO8TL+CVsCgovyRCzJLk4vyhMms1mAVEQgmMmckBX2lFDWH3nbgymISw"
    },
    "device-3c6f1f0e-9a4b-4d2e-8f1a-5b7c9d0e1f2a": {
      "alg": "mlkem768-x25519-kdf56c",
      "pkHash": "MTExMTExMTExMTExMTExMTExMTExMTExMTExMTExMTE=",
      "kemCt": "MjIyMjIyMjIyMjIyMjIyMjIyMjIyMjIyMjIyMjIyMjIyMjIyMjIyMjIyMjIyMjIyMjIyMjIyMjIyMjIyMjIyMjIyMjIyMjIyMjIyMjIyMjIyMjIyMjIyMjIyMjIyMjIyMjIyMjIyMjIyMjIyMjIyMjIyMjIyMjIyMjIyMjIyMjIyMjIyMjIyMjIyMjIyMjIyMjIyMjIyMjIyMjIyMjIyMjIyMjIyMjIyMjIyMjIyMjIyMjIyMjIyMjIyMjIyMjIyMjIyMjIyMjIyMjIyMjIyMjIyMjIyMjIyMjIyMjIyMjIyMjIyMjIyMjIyMjIyMjIyMjIyMjIyMjIyMjIyMjIyMjIyMjIyMjIyMjIyMjIyMjIyMjIyMjIyMjIyMjIyMjIyMjIyMjIyMjIyMjIyMjIyMjIyMjIyMjIyMjIyMjIyMjIyMjIyMjIyMjIyMjIyMjIyMjIyMjIyMjIyMjIyMjIyMjIyMjIyMjIyMjIyMjIyMjIyMjIyMjIyMjIyMjIyMjIyMjIyMjIyMjIyMjIyMjIyMjIyMjIyMjIyMjIyMjIyMjIyMjIyMjIyMjIyMjIyMjIyMjIyMjIyMjIyMjIyMjIyMjIyMjIyMjIyMjIyMjIyMjIyMjIyMjIyMjIyMjIyMjIyMjIyMjIyMjIyMjIyMjIyMjIyMjIyMjIyMjIyMjIyMjIyMjIyMjIyMjIyMjIyMjIyMjIyMjIyMjIyMjIyMjIyMjIyMjIyMjIyMjIyMjIyMjIyMjIyMjIyMjIyMjIyMjIyMjIyMjIyMjIyMjIyMjIyMjIyMjIyMjIyMjIyMjIyMjIyMjIyMjIyMjIyMjIyMjIyMjIyMjIyMjIyMjIyMjIyMjIyMjIyMjIyMjIyMjIyMjIyMjIyMjIyMjIyMjIyMjIyMjIyMjIyMjIyMjIyMjIyMjIyMjIyMjIyMjIyMjIyMjIyMjIyMjIyMjIyMjIyMjIyMjIyMjIyMjIyMjIyMjIyMjIyMjIyMjIyMjIyMjIyMjIyMjIyMjIyMjIyMjIyMjIyMjIyMjIyMjIyMjIyMjIyMjIyMjIyMjIyMjIyMjIyMjIyMjIyMjIyMjIyMjIyMjIyMjIyMjIyMjIyMjIyMjIyMjIyMjIyMjIyMjIyMjIyMjIyMjIyMjIyMjIyMjIyMjIyMjIyMjIyMjIyMjIyMjIyMjIyMjIyMjIyMjIyMjIyMjIyMjIyMjIyMjIyMjIyMjIyMjIyMjIyMjIyMjIyMjIyMjIyMjIyMjIyMjIyMjIyMjIyMjIyMjIyMjIyMjIyMjIyMjIyMjIyMjIyMjIyMjIyMjIyMjIyMjIyMjIyMjIyMjIyMjIyMjIyMjIyMjIyMjIyMjIyMjIyMjIyMjIyMjIyMjIyMjIyMjIyMjIyMjIyMjIyMjIyMjIyMjIyMjIyMjIyMjIyMjIyMjIyMjIyMjIyMjIyMjIyMjIyMjIyMjIyMjI=",
      "ecdhPub": "MzMzMzMzMzMzMzMzMzMzMzMzMzMzMzMzMzMzMzMzMzM=",
      "nonce": "NDQ0NDQ0NDQ0NDQ0",
      "ct": "NTU1NTU1NTU1NTU1NTU1NTU1NTU1NTU1NTU1NTU1NTU1NTU1NTU1NTU1NTU1NTU1",
      "addedAt": 1761700000000,
      "addedBy": "7d2e4c1a-5b3f-4e6d-9a8b-1c2d3e4f5a6b"
    }
  },
  "pq": {
    "kem": "hybrid-only",
    "minCapability": 2
  },
  "check": "L2G92kWoA9RdeA+il8+Bh50a8COlfHSBSIb/huP43/I="
}
