{
  "format": "slate-vault",
  "version": 3,
  "vaultId": "00000000-0000-4000-8000-0000000000aa",
  "revision": 4,
  "createdAt": 1761200000000,
  "profile": "standard",
  "suite": 2,
  "keyEpoch": 1,
  "kdf": {
    "alg": "argon2id",
    "memoryKiB": 262144,
    "passes": 4,
    "parallelism": 1,
    "salt": "BwcHBwcHBwcHBwcHBwcHBw=="
  },
  "wraps": {
    "password": {
      "alg": "aes-256-gcm",
      "nonce": "AQEBAQEBAQEBAQEB",
      "ct": "AgICAgICAgICAgICAgICAgICAgICAgICAgICAgICAgICAgICAgICAgICAgICAgIC"
    },
    "recovery": {
      "alg": "aes-256-gcm",
      "nonce": "AwMDAwMDAwMDAwMD",
      "ct": "BAQEBAQEBAQEBAQEBAQEBAQEBAQEBAQEBAQEBAQEBAQEBAQEBAQEBAQEBAQEBAQE"
    }
  },
  "history": [
    {
      "epoch": 0,
      "alg": "aes-256-gcm",
      "nonce": "BQUFBQUFBQUFBQUF",
      "ct": "BgYGBgYGBgYGBgYGBgYGBgYGBgYGBgYGBgYGBgYGBgYGBgYGBgYGBgYGBgYGBgYG"
    }
  ],
  "pq": {
    "kem": "hybrid-only",
    "minCapability": 1
  },
  "check": "AAAAAAAAAAAAAAAAAAAAAAAAAAAAAAAAAAAAAAAAAAA="
}
